{"_id":"relationship-1","tenantId":"toc","revision":1,"status":"suggested","type":"agrees_with","from":{"claimId":"claim-1","personId":"person-1"},"to":{"claimId":"claim-2","personId":"person-2"},"evidence":[{"sessionId":"session-1","turnId":"turn-1","quote":"I agree with that claim.","transcriptHash":"aaaaaaaaaaaaaaaaaaaaaaaaaaaaaaaaaaaaaaaaaaaaaaaaaaaaaaaaaaaaaaaa"}],"createdBy":"reviewer-1","sourceRevisionDigest":"bbbbbbbbbbbbbbbbbbbbbbbbbbbbbbbbbbbbbbbbbbbbbbbbbbbbbbbbbbbbbbbb"}
